<?xml version="1.0" encoding="UTF-8"?>
<!DOCTYPE CV SYSTEM "cv.dtd">
<?xml-stylesheet type="text/xsl" href="xslt.xsl"?>
<?xml-stylesheet href="style.css" type="text/css" ?>



	<page>
		<section>
				
			<identite>
				<prenom>Youness</prenom>
				<nom>CHETOUI</nom>
				<naissance>18 ans - 30/07/1997</naissance>
			</identite>
		</section>				
			
		<titre>Développeur web junior</titre>
			
		<photo></photo>
			
		<Contact>
			<titre>Contact</titre>
			<adresse>
				<numero>3</numero>
				<rue>Rue gina Pane</rue>
				<cp>35000</cp>
				<ville>Rennes</ville>
				<pays>France</pays>
			</adresse>
			<tel>06.56.80.52.63</tel>
			<mail>youness.chetoui@gmail.com</mail>				
		</Contact>
			
		<section>
			<competence>
				
				Bon relationnel - Autonomie - Capacité d'adaptation et d'organisation - Français (Langue maternelle) - Anglais (scolaire) - Esprit d'équipe - Informatique (Word, Excel, Internet, Linux, Access, PowerPoint, Open office, ...) - Dépannage Électronique (théorique et pratique) - HTML5/CSS3 - Javascript - PHP.
			</competence>
		</section>

		<section>
			<formation>
				<titre>Formations</titre>
				<intitule>Bac professionnel S.E.N (Systèmes Électroniques et Numériques) avec mention bien,</intitule>
				<date>Juin 2015, </date>
				<ecole>Lycée Charles Tillon (Rennes, France).</ecole>
			</formation>
			
			<formation>
				<intitule>BEP S.E.N (Systèmes Électroniques et Numériques)</intitule>
				<date>Juin 2014, </date>
				<ecole>Lycée Charles Tillon (Rennes, France).</ecole>
			</formation>
		</section>			

		<section>	
			<experience>	
				<date>Mai 2014 à Janvier 2015</date>
				<intitule>stagiaire chez E.Leclerc St Grégoire : Employé du S.A.V</intitule>
				<descriptif>- Relation clientèle, prise en charge d'appareil, livraison et installation.</descriptif>
			</experience>

			<experience>
				<date>Décembre 2014</date>
				<intitule>stagiaire à l'espace culturel de E.Leclerc à St Gregoire : Vendeur-conseille</intitule>
				<descriptif>- Relation clientèle, conseil clientèle, mise en rayon.</descriptif>
			</experience>

			<experience>
				<date>Mai à Juillet 2013</date>
				<intitule>stagiaire chez TVS Rennes : Technicien Hi-Fi et électroménager</intitule>
				<descriptif>- Dépannage informatique, hifi-électroménager, relation clientèle, livraison et Installation</descriptif>
			</experience>
		</section>
						
			<hobbie>
				Cinéma, basket, sortie entre amis, séries TV, voyages (Maroc, Tunisie, Espagne)
			</hobbie>	
	</page>
